{
  "meta": {
    "app": "LeafGuru",
    "schemaVersion": 1,
    "exportedAt": "2026-09-14T10:00:00.000Z",
    "appVersion": "0.1.0",
    "note": "Example dataset - one finished grow with harvest stats, one active grow with live plants, tasks, measurements, stage logs and location history. Import on the Data page."
  },
  "grows": [
    {
      "id": "47501ca1-f8cb-5334-b1b0-84afd0312033",
      "name": "Summer Autoflower 2026",
      "status": "closed",
      "locationIds": [
        "e3ac8463-f65b-519c-a8ff-1e378b8f4203"
      ],
      "startDate": "2026-05-04",
      "endDate": "2026-07-28",
      "notes": "First autoflower run in the box - went smoothly.",
      "createdAt": "2026-05-04T08:00:00.000Z",
      "updatedAt": "2026-07-28T18:00:00.000Z",
      "isDefault": false
    },
    {
      "id": "87d00d45-913f-5423-a665-fb44b88a8934",
      "name": "Autumn Photoperiod 2026",
      "status": "active",
      "locationIds": [
        "e3ac8463-f65b-519c-a8ff-1e378b8f4203",
        "b9812a21-5364-5cc9-b907-67a8dc83cc23"
      ],
      "startDate": "2026-08-25",
      "endDate": null,
      "notes": "Photoperiod girls, flipped on 2026-09-10.",
      "createdAt": "2026-08-25T08:00:00.000Z",
      "updatedAt": "2026-09-10T20:00:00.000Z",
      "isDefault": true
    }
  ],
  "locations": [
    {
      "id": "e3ac8463-f65b-519c-a8ff-1e378b8f4203",
      "name": "Growbox",
      "type": "indoor",
      "size": {
        "widthCm": 120,
        "depthCm": 60,
        "heightCm": 180,
        "areaM2": 0.72
      },
      "notes": "Main indoor tent.",
      "active": true,
      "createdAt": "2026-05-01T08:00:00.000Z",
      "updatedAt": "2026-05-01T08:00:00.000Z"
    },
    {
      "id": "b9812a21-5364-5cc9-b907-67a8dc83cc23",
      "name": "Sunny Balcony",
      "type": "outdoor",
      "size": {
        "widthCm": null,
        "depthCm": null,
        "heightCm": null,
        "areaM2": 2.5
      },
      "notes": "Hardening-off spot.",
      "active": true,
      "createdAt": "2026-05-01T08:05:00.000Z",
      "updatedAt": "2026-05-01T08:05:00.000Z"
    }
  ],
  "equipment": [
    {
      "id": "8b99ee1f-b758-55f2-b549-1b7552a95fdc",
      "growId": "47501ca1-f8cb-5334-b1b0-84afd0312033",
      "name": "LED Panel 240W",
      "category": "light",
      "specs": "240W quantum board, 3500K",
      "purchaseDate": "2026-04-20",
      "cost": 189.9,
      "currency": "EUR",
      "status": "in-use",
      "notes": null,
      "locationAssignments": [
        {
          "locationId": "e3ac8463-f65b-519c-a8ff-1e378b8f4203",
          "from": "2026-05-04T08:00:00.000Z",
          "to": null
        }
      ],
      "createdAt": "2026-04-20T10:00:00.000Z",
      "updatedAt": "2026-05-04T08:00:00.000Z"
    },
    {
      "id": "326a632a-ef7a-52fa-bfb8-626319495ec9",
      "growId": "47501ca1-f8cb-5334-b1b0-84afd0312033",
      "name": "Pot set 11L",
      "category": "pot",
      "specs": "4 fabric pots",
      "purchaseDate": "2026-04-25",
      "cost": 24.5,
      "currency": "EUR",
      "status": "stored",
      "notes": null,
      "locationAssignments": [],
      "createdAt": "2026-04-25T10:00:00.000Z",
      "updatedAt": "2026-07-28T18:00:00.000Z"
    },
    {
      "id": "850a4e63-a09d-5904-bfbd-411d02ed58e8",
      "growId": "87d00d45-913f-5423-a665-fb44b88a8934",
      "name": "Clip fan 15cm",
      "category": "fan",
      "specs": null,
      "purchaseDate": null,
      "cost": 15,
      "currency": "EUR",
      "status": "in-use",
      "notes": null,
      "locationAssignments": [
        {
          "locationId": "e3ac8463-f65b-519c-a8ff-1e378b8f4203",
          "from": "2026-08-25T09:00:00.000Z",
          "to": null
        }
      ],
      "createdAt": "2026-08-25T09:00:00.000Z",
      "updatedAt": "2026-08-25T09:00:00.000Z"
    },
    {
      "id": "fa1b04ee-cc98-5ddd-bbc5-211d8dbb0e18",
      "growId": null,
      "name": "pH meter",
      "category": "sensor",
      "specs": "pH + EC combo",
      "purchaseDate": "2026-04-15",
      "cost": 32,
      "currency": "EUR",
      "status": "in-use",
      "notes": "Shared across grows.",
      "locationAssignments": [],
      "availableEverywhere": true,
      "createdAt": "2026-04-15T10:00:00.000Z",
      "updatedAt": "2026-04-15T10:00:00.000Z"
    }
  ],
  "strainTemplates": [
    {
      "id": "360640f3-9f3e-581c-98e8-c5cde795b62a",
      "name": "Fast Berry Auto",
      "breeder": "Hypothetical Seeds",
      "genotype": "hybrid",
      "stageDurations": {
        "seedling": 10,
        "vegetative": 28,
        "flowering": 49
      },
      "expectedHeightCm": 90,
      "characteristics": "Berry scent, forgiving, good for small tents.",
      "notes": null,
      "createdAt": "2026-05-01T09:00:00.000Z",
      "updatedAt": "2026-05-01T09:00:00.000Z"
    },
    {
      "id": "35f0469c-63f7-519d-9aea-b9e81d31138f",
      "name": "Purple Sunset",
      "breeder": "Valley Genetics",
      "genotype": "indica",
      "stageDurations": {
        "seedling": 14,
        "vegetative": 35,
        "flowering": 60
      },
      "expectedHeightCm": 110,
      "characteristics": "Dark colors in late flowering, dense buds.",
      "notes": null,
      "createdAt": "2026-08-20T09:00:00.000Z",
      "updatedAt": "2026-08-20T09:00:00.000Z"
    }
  ],
  "plants": [
    {
      "id": "44c193d2-2912-5a30-b620-403ade8e6e16",
      "growId": "47501ca1-f8cb-5334-b1b0-84afd0312033",
      "name": "Berry #1",
      "strainTemplateId": "360640f3-9f3e-581c-98e8-c5cde795b62a",
      "customStrain": null,
      "sex": "female",
      "germinationDate": "2026-05-04",
      "stage": "cured",
      "locationId": null,
      "status": "cured",
      "notes": "Best of the run.",
      "harvestYieldG": 42.5,
      "harvestedAt": "2026-07-16",
      "createdAt": "2026-05-04T08:10:00.000Z",
      "updatedAt": "2026-08-10T10:00:00.000Z",
      "budG": 38.5,
      "leafG": 6.2,
      "sugarLeafG": 4.1,
      "stemG": 9.4,
      "smellTerpenes": "berry, sweet, slight diesel"
    },
    {
      "id": "43e74492-9a1c-5347-8edd-93eb407a4194",
      "growId": "47501ca1-f8cb-5334-b1b0-84afd0312033",
      "name": "Berry #2",
      "strainTemplateId": "360640f3-9f3e-581c-98e8-c5cde795b62a",
      "customStrain": null,
      "sex": "female",
      "germinationDate": "2026-05-06",
      "stage": "cured",
      "locationId": null,
      "status": "cured",
      "notes": "A bit stretchy.",
      "harvestYieldG": 31,
      "harvestedAt": "2026-07-18",
      "createdAt": "2026-05-06T08:10:00.000Z",
      "updatedAt": "2026-08-10T10:00:00.000Z",
      "budG": 27.0,
      "leafG": 5.0,
      "sugarLeafG": 3.2,
      "stemG": 7.8,
      "smellTerpenes": "berry, earthy"
    },
    {
      "id": "dd8b53e6-698b-573c-8c9d-972596d0e724",
      "growId": "87d00d45-913f-5423-a665-fb44b88a8934",
      "name": "Sunset Alpha",
      "strainTemplateId": "35f0469c-63f7-519d-9aea-b9e81d31138f",
      "customStrain": null,
      "sex": "female",
      "germinationDate": "2026-08-25",
      "stage": "flowering",
      "locationId": "e3ac8463-f65b-519c-a8ff-1e378b8f4203",
      "status": "growing",
      "notes": "Topped after 5 nodes.",
      "harvestYieldG": null,
      "harvestedAt": null,
      "createdAt": "2026-08-25T08:10:00.000Z",
      "updatedAt": "2026-09-10T20:00:00.000Z"
    },
    {
      "id": "72323bd1-f017-5fb7-add7-694eddded834",
      "growId": "87d00d45-913f-5423-a665-fb44b88a8934",
      "name": "Sunset Beta",
      "strainTemplateId": "35f0469c-63f7-519d-9aea-b9e81d31138f",
      "customStrain": null,
      "sex": "female",
      "germinationDate": "2026-08-27",
      "stage": "flowering",
      "locationId": "e3ac8463-f65b-519c-a8ff-1e378b8f4203",
      "status": "growing",
      "notes": "Hardened off on the balcony first.",
      "harvestYieldG": null,
      "harvestedAt": null,
      "createdAt": "2026-08-27T08:10:00.000Z",
      "updatedAt": "2026-09-10T20:00:00.000Z"
    }
  ],
  "stageLogs": [
    {
      "id": "db7fb1bc-1421-5c8d-ad8e-678ce03e606c",
      "plantId": "44c193d2-2912-5a30-b620-403ade8e6e16",
      "stage": "germinating",
      "enteredAt": "2026-05-04T08:10:00.000Z",
      "leftAt": "2026-05-06T08:00:00.000Z",
      "createdAt": "2026-05-04T08:10:00.000Z",
      "updatedAt": "2026-05-06T08:00:00.000Z"
    },
    {
      "id": "11d40670-7e8a-5ca5-b3eb-5e3884dabcab",
      "plantId": "44c193d2-2912-5a30-b620-403ade8e6e16",
      "stage": "seedling",
      "enteredAt": "2026-05-06T08:00:00.000Z",
      "leftAt": "2026-05-16T08:00:00.000Z",
      "createdAt": "2026-05-06T08:00:00.000Z",
      "updatedAt": "2026-05-16T08:00:00.000Z"
    },
    {
      "id": "f5b6e5df-8e71-545a-875f-d31c44463bc8",
      "plantId": "44c193d2-2912-5a30-b620-403ade8e6e16",
      "stage": "vegetative",
      "enteredAt": "2026-05-16T08:00:00.000Z",
      "leftAt": "2026-06-13T08:00:00.000Z",
      "createdAt": "2026-05-16T08:00:00.000Z",
      "updatedAt": "2026-06-13T08:00:00.000Z"
    },
    {
      "id": "1211d7eb-5a79-5e0a-9d1c-7c00d9e5aea5",
      "plantId": "44c193d2-2912-5a30-b620-403ade8e6e16",
      "stage": "flowering",
      "enteredAt": "2026-06-13T08:00:00.000Z",
      "leftAt": "2026-07-16T08:00:00.000Z",
      "createdAt": "2026-06-13T08:00:00.000Z",
      "updatedAt": "2026-07-16T08:00:00.000Z"
    },
    {
      "id": "c0fb4306-a066-5add-8688-2a7ee599321d",
      "plantId": "44c193d2-2912-5a30-b620-403ade8e6e16",
      "stage": "drying",
      "enteredAt": "2026-07-16T08:00:00.000Z",
      "leftAt": "2026-07-22T08:00:00.000Z",
      "createdAt": "2026-07-16T08:00:00.000Z",
      "updatedAt": "2026-07-22T08:00:00.000Z"
    },
    {
      "id": "d7a42064-400c-59d9-9254-048613d5b87f",
      "plantId": "44c193d2-2912-5a30-b620-403ade8e6e16",
      "stage": "cured",
      "enteredAt": "2026-07-22T08:00:00.000Z",
      "leftAt": "2026-08-10T08:00:00.000Z",
      "createdAt": "2026-07-22T08:00:00.000Z",
      "updatedAt": "2026-08-10T08:00:00.000Z"
    },
    {